{
  "api": {
    "api_indexes": {
      "cancelReservation": "docs/spec/40.apis/reservations/cancel_reservation/index.md",
      "createReservation": "docs/spec/40.apis/reservations/create_reservation/index.md",
      "createResource": "docs/spec/40.apis/resources/create_resource/index.md",
      "getReservation": "docs/spec/40.apis/reservations/get_reservation/index.md",
      "getResourceSchedule": "docs/spec/40.apis/resources/get_resource_schedule/index.md",
      "listReservations": "docs/spec/40.apis/reservations/list_reservations/index.md",
      "listResources": "docs/spec/40.apis/resources/list_resources/index.md",
      "updateResource": "docs/spec/40.apis/resources/update_resource/index.md"
    },
    "group_indexes": {
      "reservations": "docs/spec/40.apis/reservations/index.md",
      "resources": "docs/spec/40.apis/resources/index.md"
    },
    "index": "docs/spec/40.apis/index.md",
    "operation_inventory": "docs/spec/40.apis/operations.json",
    "operations": [
      {
        "api": "cancel_reservation",
        "documents": {
          "detail-design": "docs/spec/40.apis/reservations/cancel_reservation/detail-design_gen.md",
          "interface": "docs/spec/40.apis/reservations/cancel_reservation/interface_gen.md",
          "messages": "docs/spec/40.apis/reservations/cancel_reservation/messages_gen.md",
          "query": "docs/spec/40.apis/reservations/cancel_reservation/query_gen.md",
          "sequence": "docs/spec/40.apis/reservations/cancel_reservation/sequence_gen.md",
          "unit-test": "docs/spec/40.apis/reservations/cancel_reservation/unit-test_gen.md"
        },
        "group": "reservations",
        "id": "cancelReservation",
        "sections": {
          "cases": [
            "TC001",
            "TC002",
            "TC003",
            "TC004",
            "TC005",
            "TC006",
            "TC007",
            "TC008"
          ],
          "factors": [
            "F01 条件分岐",
            "F02 条件分岐",
            "F03 条件分岐",
            "F04 条件分岐",
            "F05 例外処理"
          ],
          "messages": [
            "`M001` `cancelReservation.caller_cannot_cancel_reservation`",
            "`M002` `cancelReservation.stale_reservation_version`",
            "`M003` `cancelReservation.reservation_already_cancelled`",
            "`M004` `cancelReservation.reservation_already_started`",
            "`M005` `cancelReservation.router_api_function_error`"
          ],
          "queries": [
            "001_select_reservations.sql",
            "002_update_resources_control_version.sql",
            "003_update_reservations.sql",
            "004_insert_reservation_events.sql"
          ],
          "request_bodies": [
            "Request body `CancelReservationRequest`"
          ],
          "resource_changes": [
            "DB `resources` 更新",
            "DB `reservations` 更新",
            "DB `reservation_events` 作成"
          ],
          "responses": [
            "`200` Successful Response",
            "`401` 認証情報が未指定、期限切れ、または検証できない場合。",
            "`403` 呼び出し元が予約者本人でも管理者でもない場合。",
            "`404` 指定された予約が存在しない場合。",
            "`409` 予約の版が古い、取消済み、または開始済みの場合。",
            "`422` pathまたはbodyがOpenAPIスキーマの型や制約に一致しない場合。",
            "`429` 呼び出し頻度が許可された上限を超えた場合。",
            "`500` SlotKeeper内部で想定外のエラーが発生した場合。",
            "`503` DBの競合や接続障害が再試行上限を超えた場合。"
          ],
          "samples": [
            "HTTP 200",
            "HTTP 401",
            "HTTP 403",
            "HTTP 404",
            "HTTP 409",
            "HTTP 422",
            "HTTP 429",
            "HTTP 500",
            "HTTP 503"
          ]
        }
      },
      {
        "api": "create_reservation",
        "documents": {
          "detail-design": "docs/spec/40.apis/reservations/create_reservation/detail-design_gen.md",
          "interface": "docs/spec/40.apis/reservations/create_reservation/interface_gen.md",
          "messages": "docs/spec/40.apis/reservations/create_reservation/messages_gen.md",
          "query": "docs/spec/40.apis/reservations/create_reservation/query_gen.md",
          "sequence": "docs/spec/40.apis/reservations/create_reservation/sequence_gen.md",
          "unit-test": "docs/spec/40.apis/reservations/create_reservation/unit-test_gen.md"
        },
        "group": "reservations",
        "id": "createReservation",
        "sections": {
          "cases": [
            "TC001",
            "TC002",
            "TC003",
            "TC004",
            "TC005",
            "TC006",
            "TC007",
            "TC008"
          ],
          "factors": [
            "F01 条件分岐",
            "F02 条件分岐",
            "F03 条件分岐",
            "F04 条件分岐",
            "F05 例外処理"
          ],
          "messages": [
            "`M001` `createReservation.idempotency_key_reused`",
            "`M002` `createReservation.resource_inactive`",
            "`M003` `createReservation.slot_taken`",
            "`M004` `createReservation.router_api_function_error`"
          ],
          "queries": [
            "001_select_idempotency_records.sql",
            "002_update_resources_control_version.sql",
            "003_select_reservations.sql",
            "004_delete_idempotency_records.sql",
            "005_insert_users.sql",
            "006_insert_reservations.sql",
            "007_insert_reservation_events.sql",
            "008_insert_idempotency_records.sql"
          ],
          "request_bodies": [
            "Request body `CreateReservationRequest`"
          ],
          "resource_changes": [
            "DB `resources` 更新",
            "DB `idempotency_records` 削除",
            "DB `users` 作成",
            "DB `reservations` 作成",
            "DB `reservation_events` 作成",
            "DB `idempotency_records` 作成"
          ],
          "responses": [
            "`201` Successful Response",
            "`401` 認証情報が未指定、期限切れ、または検証できない場合。",
            "`404` 予約対象の資源が存在しない場合。",
            "`409` 予約枠が重なる、資源が無効、または同じIdempotency-Keyで異なる入力を送った場合。",
            "`422` bodyまたはheaderが型や制約に一致しない、または予約時刻の規則に反する場合。",
            "`429` 呼び出し頻度が許可された上限を超えた場合。",
            "`500` SlotKeeper内部で想定外のエラーが発生した場合。",
            "`503` DBの競合や接続障害が再試行上限を超えた場合。"
          ],
          "samples": [
            "HTTP 201",
            "HTTP 401",
            "HTTP 404",
            "HTTP 409",
            "HTTP 422",
            "HTTP 429",
            "HTTP 500",
            "HTTP 503"
          ]
        }
      },
      {
        "api": "create_resource",
        "documents": {
          "detail-design": "docs/spec/40.apis/resources/create_resource/detail-design_gen.md",
          "interface": "docs/spec/40.apis/resources/create_resource/interface_gen.md",
          "messages": "docs/spec/40.apis/resources/create_resource/messages_gen.md",
          "query": "docs/spec/40.apis/resources/create_resource/query_gen.md",
          "sequence": "docs/spec/40.apis/resources/create_resource/sequence_gen.md",
          "unit-test": "docs/spec/40.apis/resources/create_resource/unit-test_gen.md"
        },
        "group": "resources",
        "id": "createResource",
        "sections": {
          "cases": [
            "TC001",
            "TC002",
            "TC003",
            "TC004",
            "TC005"
          ],
          "factors": [
            "F01 条件分岐",
            "F02 例外処理"
          ],
          "messages": [
            "`M001` `createResource.caller_cannot_manage_resources`",
            "`M002` `createResource.router_api_function_error`"
          ],
          "queries": [
            "001_insert_resources.sql"
          ],
          "request_bodies": [
            "Request body `CreateResourceRequest`"
          ],
          "resource_changes": [
            "DB `resources` 作成"
          ],
          "responses": [
            "`201` Successful Response",
            "`401` 認証情報が未指定、期限切れ、または検証できない場合。",
            "`403` 呼び出し元が資源を管理できる管理者でない場合。",
            "`422` bodyがOpenAPIスキーマの型や制約に一致しない場合。",
            "`429` 呼び出し頻度が許可された上限を超えた場合。",
            "`500` SlotKeeper内部で想定外のエラーが発生した場合。",
            "`503` DBの競合や接続障害が再試行上限を超えた場合。"
          ],
          "samples": [
            "HTTP 201",
            "HTTP 401",
            "HTTP 403",
            "HTTP 422",
            "HTTP 429",
            "HTTP 500",
            "HTTP 503"
          ]
        }
      },
      {
        "api": "get_reservation",
        "documents": {
          "detail-design": "docs/spec/40.apis/reservations/get_reservation/detail-design_gen.md",
          "interface": "docs/spec/40.apis/reservations/get_reservation/interface_gen.md",
          "messages": "docs/spec/40.apis/reservations/get_reservation/messages_gen.md",
          "query": "docs/spec/40.apis/reservations/get_reservation/query_gen.md",
          "sequence": "docs/spec/40.apis/reservations/get_reservation/sequence_gen.md",
          "unit-test": "docs/spec/40.apis/reservations/get_reservation/unit-test_gen.md"
        },
        "group": "reservations",
        "id": "getReservation",
        "non_applicable": {
          "request_bodies": "Request body はありません。",
          "resource_changes": "正常系で作成/更新/削除するリソースはありません。"
        },
        "sections": {
          "cases": [
            "TC001",
            "TC002",
            "TC003",
            "TC004",
            "TC005"
          ],
          "factors": [
            "F01 条件分岐",
            "F02 例外処理"
          ],
          "messages": [
            "`M001` `getReservation.caller_cannot_view_reservation`",
            "`M002` `getReservation.router_api_function_error`"
          ],
          "queries": [
            "001_select_reservations.sql",
            "002_select_reservation_events.sql"
          ],
          "request_bodies": [],
          "resource_changes": [],
          "responses": [
            "`200` Successful Response",
            "`401` 認証情報が未指定、期限切れ、または検証できない場合。",
            "`403` 呼び出し元が予約者本人でも管理者でもない場合。",